Indicator,Definition,System Part,Units,Calculation,ID,Objective,Comment
AT - Apparent Temperature,"“Feels‐like” temperature expressing how hot it actually feels to humans, accounting for air temperature, humidity and wind speed.",,C,"AT = [0.89 x Ta] + [3.82 x (e/10)] - 2.56, where: Ta = Mean annual / monthly maximum temperature (°C) (1976 - 2005)
e = Mean annual / monthly 3pm vapour pressure (hPa) (1976 - 2005)",164,15,,
AWGBT - Aproximated Wet Bulb globe Temperature,An index that can be used for evaluating outdoor thermal stress conditions.,,C,AWBGT = 0.567T a + 0.393e w + 3.94,165,15,,
BGT - Black globe Temperature,"Measurement consists of a hollow copper sphere (90 mm diameter) painted mattblack, to absorb radiant heat, with a temperature sensor at its centre",,C,Direct measurement,166,17,,
CDH -  Cooling Degree Hour,measurement to analyze the accumulated cooling needs over a specific time period based on the climatic change of the outdoor environment.,,C.d,"CDH = Σ[k=0 to n] { (t_oa,k - t_b, if t_oa,k > t_b; 0, if t_oa,k ≤ t_b) }",167,16,,
CIHB -  Comfort Index Human Body,It is an indicator improved by Chinese scholars based on the Temperature and Humidity Index (THI) which is a method for characterizing human comfort from the perspective of biometeorology,,%,CIHB = 1.8 × AT + 0.55 × (1 - RH) + 32 - 3.2 × √WS,168,15,,
CTSC - Composite Thermal Comfort Score,"CTCS takes into account the extent, duration, and intensity of the thermal stress assessed by the UTCI, which could comprehensively evaluate the OTC of cities",,--,CTCS = (Σ[i=1 to n] Σ[j=0 to 9] (q_ij × w_j)) / n,169,15,,
DI - Discomfort Index,Combination of temperature and humidity that evaluates how current temperature and relative humidity affect the discomfort sensation and cause health risk in the population,,C,DI = Ta − 0.55 (1 − 0.01 RH) (Ta − 14.5),170,15,,
HI - Heat Index,Apparent temperature index combining air temperature and relative humidity to quantify how hot it feels to the human body.,,F,"−42.379+2.04901523T a​ +10.14333127RH−0.22475541T a​ RH−6.83783×10 −3 T a2​ −5.481717×10 −2 RH 2 +1.22874×10 −3 T a2​ RH+8.5282×10 −4 T a​ RH 2 −1.99×10 −6 T a2​ RH 2
2R",171,15,Rothfusz equation,
HIA - Heat Island Area,accessibility-based residents’ heat exposure risk,,Km2,A_i^HIA = Σ[j=1 to n] { S_j^HIA * (1 + NDBI_j) * [Σ[k=1 to m] (D_k * f(d_kj))]^(1/2) * f(d_ij) },172,16,,
HIP - Heat Island Potential,"evaluation model can estimate the heat island effect in a planned urban area using the planning indicators (building density, floor area ratio, green coverage, etc.",,--,HIP_sum = 227.05η_B + 76.12η_C + 54.31η_D + 30.8η_E - 1.44η_F - 22.77η_G - 88.4η_H,173,16,,
HWDD -  Heat Wave degree days,This indicator provides an aggregate picture of the total duration and weight of heat waves throughout a selected period,,C.d,"HWDD = Σ[i=1 to D] { [(T_min,i - 18.2°C)^+ + (T_max,i - 29.6°C)^+] * h_i }",174,16,,
HWMId -Heat Wave Magnitude Index daily,integrates both the length and the magnitude of a heat wave to calculate its overall strength,,C,"HW_M = { (TX - TXx25p) / (TXx75p - TXx25p), if TX > TXx25p; 0, otherwise }",175,16,,
HX - Humidex,humidex is an equivalent dry-air temperature; air of a given temperature and moisture content is equated in comfort to air of a higher temperature which has a negligible moisture content,,--,Humidex = Ta + 0.5555 × 6.11 × e^(1/273.15(Td - 273.15)),176,15,,
LST - Land Surface Temperature,"Radiant temperature of the ground/terrain as detected by thermal‐infrared sensors, representing the emission temperature of land surfaces.",,C,LST = T_B / (1 + (λσT_B / ℏc)) T_B = K_2 / (ln(K_1 / L_λ) + 1)L_λ = 0.0003342 × DN + 0.1,177,17,,
NET - Net Effective Temperature,"Links effective temperature, which indicates the effects on comfort through air temperature and relative humidity, and an organism's thermoregulatory capacity.",,C,NET = 37 - ((37 - T) / (0.68 - 0.0014RH + (1 / (1.76 + 1.4v^0.75)))) - 0.29T(1 - 0.01RH),178,15,,
OTCA - Outdoor Thermal comfort Autonomy,Percentege of time over a year that an area meets a given set of Thermal comfort Accepatbility Criteria,,%,"""1"" /""N""  ∑_""k=11"" ^""16"" ▒〖"" "" 〖""TC"" 〗_""k""  〗 ""∙100""",179,15,Using Envi-met,
PCI - Park Cold Island Effect,"park-type urban cold island is called PCI (Park Cold Island), and its effect intensity is characterized by the difference between the ground temperature inside and outside the park",,C,PCI = ΔT = TU − TP,180,17,Cooling Effect,
PDD - Predicted Percentage of Dissatisfied,Percentage of people who would be dissatisfied with the climate conditions,,%,PPD = 100 - 95 * e^(- (0.03353 * PMV^4 + 0.2179 * PMV^2)),181,15,,
PET - Physiological Equivalent Temperature index,"temperature at any given place (outdoors or indoors) and is equivalent to the air temperature at which, in a typical indoor setting, the heat balance of the human body (work metabolism 80 W of light activity, added to basic metabolism; heat resistance of clothing 0.9 clo) is maintained with core and skin  emperatures equal to those under the conditions being assessed.",,C,"f(Ta[C] VP[hPa], v_1.2 [m/s], Tmrt[], Work, Gender)",182,15,"Ta = temperature, VP = Vapor Pressure, v_1.2 = Windspeed at 1.2m, Tmrt = Mean Radian Temperature",
PMV - Predicted Mean Vote Index,"PMV index is a function of six variables: physiological variables and the rest are environmental variables. PMV index values range from −3 to +3, which describes the feeling of cold to hot",,--,[(0.303⋅e−0.036⋅M)+0.028]⋅[(M−W)−3.05⋅(5.733−0.007⋅(M−W)−Pa)−0.42⋅((M−W)−58.15)−0.0173⋅M⋅(5.867−Pa)−0.0014⋅M⋅(Ta−Tsk )−hc(Tsk−Tr )],183,15,Using Bio-met,
RHSI - Radiant Heat Stress Index,"valuates dynamic changes in heat stress
based on Tmrt, a key meteorological parameter representing the impact of thermal radiation
on human thermal comfort",,--,"RHSI = Σ[i=1 to n] T_mrt(i) = { (i - 55°C), if T_mrt(i) ≥ 55°C; 0, if T_mrt(i) < 55°C }",184,15,,
Average Fixed Mortgage rate,mean interest rate charged on mortgage loans with a fixed interest rate over a defined period. It reflects borrowing conditions in the housing market.,,%,"AFMR_y = \frac{1}{n} \sum_{i=1}^{n} r_{i,y}\text{where:} \quad AFMR_y = \text{Average Fixed Mortgage Rate in year } y, \quad r_{I,y} = \text{Fixed mortgage rate on loan } I \text{ in year } y",310,22,,
Park/Green Quality Index,"Indicator that relates vegetation, Equipment and Furnishing of parks. This is assumed as a proxy for Increased property value. Can be measured in Total Green/blue area, NDVI, % of land cover and/or green visibility",,--,PGQI_i = w_1 \cdot \text{NDVI}_i + w_2 \cdot \text{GreenCoverage}_i + w_3 \cdot \text{GreenVisibility}_i + w_4 \cdot \text{EquipScore}_i\text{subject to:} \quad \sum_{k=1}^{4} w_k = 1,311,19,,
Monthly mortgage Repayment,Average monthly payment made by households on mortgage loans.,,M.U./month,sum of all mortgage repayments in month/Total mortages value,312,22,,
Monthly rent payment,Average monthly rent paid by tenants.,,M.U./month,Sum of rents paid by households/ number of renting households,313,22,,
Monthly services costs,"Costs of Water, electricity, waste incurred by a household per month",,M.U./month,Total services bills in month/Number of households,314,22,,
Total monthy Housing cost,Sum of rent/mortgage payment and monthly costs,,M.U./month,Rent + Services,315,22,,
Private Transportation costs,Mean commuting expenditure by cost of vehicle ownership and operational costs of commuting per unit of distance,,M.U./month,Vehicle amortization + (Operation cost [M.U./km]/distance commute [km]),316,22,,
Public transportation expenditure,Average monthly household spending on public transport.,,M.U./month,Total public transit fares paid in month/number of households,317,22,,
Rent - income ratio,amount or percentage of income paid for rent or a mortgage as a cost of living,,%,Average monthly rent/average monthly disposable income *100,318,22,,
Overcrowdign rates,Available space in sqm per habitable room (excluding kitchen/baths),,%,Total habitable area / Number of residents,319,19,,
Housing Tenure distribution,Share of households in different tenure types,,%,Households in tenure type j / Total households *100,320,18,,
Share of households reciving housing allowance,Refers to the size and number of rooms available for members of the same family in the same property and is based on age and gender,,%,Housholds receiving allowance/total households,321,22,,
Population density,Number of people per unit of land area.,,P/km2,Total population / Land area,322,21,,
Housing related expenditure,final consumption expenditure incurred by families for goods and services purchased to satisfy their needs and desires,,M.U,Housing costs/total household expenditure*100,323,22,,
Living Area,"refers to the total floor area within a residential unit that is heated, habitable, and finished.",,m2,"\text{Living Area} = \sum_{i=1}^{n} A_i   \text{where:} \quad A_i = \text{Area of each finished, habitable room}",324,19,,
Property age at sale,Age of the dwelling at time of sale (time since original construction completion).,,year,Age s​ =SaleYear s​ −CompletionYear s​,325,19,,
Vacancy Rate,percentage of the total number of housing units that are presently unoccupied,,%,Vacant units / Total housing units *100,326,18,,
Land Prices-GDP Elasticity,Characterizes the relationship between residential land prices and macroeconomic development,,--,% change land prices/ % change GDP,327,22,,
Proportion of Residential land supply,Reflects the balance of residential land in the market,,%,"X2 = Ri,j/ Ti,j Where X2 denotes the proportion of the residential land supply area in total land supply. Rij denotes the area of residential land supply in the county i in year j. Ti,j denotes the total area of construction land supply in county i in yea",328,20,,
Degree of Marketization for residential land,Reflects the structural balance of market land supply,,%,"X3 = ri,j/ Ri,j ri,j represents the area of residential land sold by county i through biddings, auctions, and listings in year j, and Ri,j",329,20,,
Utilization rate of stock land,Reflects the structural balance of stock and new land use in the market,,%,"X4 = Ci,j/ Ri,j Where X4 denotes the utilization rate of stock land, Ci,j denotes the stock land area of residential land supplied by county i in year j, and Ri,j denotes the total area of residential land supply in county i in year j",330,20,,
Rate of Residential Land supply,Measures the efficiency of land market allocation and the degree of land conservation and land use intensification,,%," = Ji,j/Ri,j J represents the planned area of residential Land and R denotates the toal area of residential land supply",331,20,,
Per capita residential land supply area,Measures the balance of residential land supply and population scale,,m2/capita,"= Ri,j / Pi,j Pi,j denotes the urban population in county i in year j, and Ri,j denotes the total area of residential land supply in county i in year j",332,20,,
Proportion of land for affordable housing,Measures the supply of and demand for land for affordable housing,,%,"X7 = Bi,j / Ri,j Where X7 denotes the proportion of land for affordable housing in total land supply, Bi,j denotes the area of affordable housing land supplied by county i in year j, and Ri,j denotes the total area of residential land supply in county i i",333,20,,
Revenue from residential land transfers,Reflects the degree of dependence on land finance and activity intensity in the land market,,%,"X8 = Ni,j /(Ni,j+Mi,j) Ni,j denotes revenue from residential land sale in county i in year j, and Mi,j denotes the local general public budget revenue of county i in year",334,20,,
Residential land transaction area,denotes the total area of residential land transactions in a Year,,km2/yr,Sum parcel area all transaction per year,335,18,,
Street Greeness,Proportion of street network length with tree canopy or planted greenery visible from the road.,,--,Length of greened street/ total street length,336,19,,
Property Listing Price / Sale Price,Price set by the seller (or real estate agent) when a property is advertised for sale.,,M.U.,\text{Price}_i = \beta_0 + \beta_1 \cdot \text{Size}_i + \beta_2 \cdot \text{Location}_i + \beta_3 \cdot \text{Age}_i + \beta_4 \cdot \text{Bedrooms}_i + \beta_5 \cdot \text{Bathrooms}_i + \cdots + \varepsilon_i,337,22,,
Average Effort Rate,"represents the relationship between the total monthly incomes of a family, versus the amount owed on credit installments",,%,AER  = MP/HI × 100 || AER = AHV/HI x 100,338,22,,
Land Benchmark Price,"Standardized price per unit area (e.g. €/m²) of land in a given zone, established based on official assessments, or market modeling.It serves as a reference value for taxation, planning, and real estate evaluation",,M.U.,\text{LBP}_z = \frac{\sum_{I \in T(z)} P_i}{\sum_{I \in T(z)} A_i} \text{This gives a weighted average price per m² across the zone.},339,22,,
Urban Population Growth Rate,Year-on-year growth in the urban resident population.,,%,Urban Pop t - Urban pop t-1 / Urban pop t-1 *100,340,21,,
Building Quality Evaluation,developed by CIRI (Centro Interdipartimentale per la Ricerca Industriale) is focused on the enhancement and management of assets,,--,"BQE i​ = k=1∑m​ w k​ S i,k​ , where 𝑆𝑖,𝑘S i,k​ =score on criterion k and ∑𝑤𝑘=1∑w k​ =1.",341,19,,
Gross Surface,"Gross Floor Area (GFA), is the total floor area of a building measured to the outer walls (external faces), including all enclosed spaces on all floors.",,m2,\text{GrossSurface} = \text{Footprint Area} \times \text{Number of Floors},342,19,,
SET - Standard Effective Temperature," reflects thermal regulation in the human body based on a two physiological variables, skin temperature and skin wettedness",,C,"Calculated via the RayMan/COMFA algorithm using inputs: air temperature, mean radiant temperature, relative humidity, air velocity, metabolic rate and clothing insulation; output is the equivalent reference temperature (°C) at 50 % RH.",185,15,via Rayman,
SOCI - State Outdoor Comfort Index,a model that can directly predict outdoor thermal comfort by increasing clothing thermal resistance and metabolic rate based on the PET index,,--,0.178PET + 0.276Met + 1.171Clo − 5.557,186,15,,
spOTCA - Spatial OTCA,percentage of an outdoor space that is within the desired thermal comfort range at least 50% of the time considered,,%,Area with acceptable OTCA / Area Total,187,15,,
SUHII - Surface Urban Heat Island Intensity,"Difference in land‐surface temperature between urban areas and their surrounding rural reference, quantifying the extra heating due to urbanization.",,,(LSTi - Avg LST),188,17,,
SUHIIen - Surface Urban Heat Island pixel Enhancement,indicator aims to high-light pixel-level SUHII variations across the whole urban area through explicitly accounting for the heating or cooling influences of neighboring pixels on center pixels based on a kernel convolution process,,--,"SUHIlen[x,y] = (SUHIlen[x,y] - SUHIlen_ave) / (SUHIlen_max - SUHIlen_ave)",189,17,,
THI - Thermal Humidity Index,Is a combination of temperature and humidity that represents an individual's level of discomfort in warm weather,,C,THI = 0.8T + (RH x T)/500,190,15,,
Tmrt -  Mean Radiant Temperature,"Uniform surrounding temperature in an imaginary enclosure in which the radiant
heat transfer from a human body to the enclosure surfaces is equal to
the heat transfer to the surfaces of an actual enclosure with non–
uniform temperatures",,C,[(Ta^4 + (1 / (ε * σ)) * (K↓ + K↑ + L↓ + L↑) / hc)]^(1/4),191,17,,
TpN - Number of Tropical Nights,Number of nights with temperature above 20°C,,d,Direct Measurement,192,16,,
TSI - Thermal Stress Indicator,average deviation of PET from the acceptable thermal comfort range at each space,,--,"TSI=(1/K-1)∙〖∆T〗_crit
where K, the scaling factor between 0 and 1 is computed as 
K=1/N ∑_(k=11)^16▒〖 m_k 〗
m_k={█(     1〖        if |∆T|≤ ∆T〗_crit@〖∆T〗_crit/|〖∆T〗_k |             otherwise)┤
〖∆T〗_crit is the acceptable temperature range (A) from the midpoint defined as
〖∆T〗_crit=(A_max-A_min )/2
And 〖∆T〗_kis the difference of the thermal comfort index (i.e. PET) at any timefrom the midpoint of the thermal comfort acceptable range (A), as described by Heng & Chow (2019)
〖∆T〗_k=PET- (A_max+A_min )/2",193,15,,
TSV - Thermal Sensation Vote,"index was developed and validated under Singapor outdoor thermal conditions The model uses
four input variables (air temperature, relative humidity, wind speed, and mean radiant temperature",,--,"TSV = respondent’s rating on the ASHRAE 7-point scale: –3 Cold, –2 Cool, –1 Slightly cool, 0 Neutral, +1 Slightly warm, +2 Warm, +3 Hot.",194,15,Range -3 to +3. Specific for Singapore,
Twmax - Maximum Wet-bulb Temperature,Wmax establishes a clear thermodynamic limit on heat transfer that cannot be offset by adaptations. Higher values of Twmax imply hot and humid conditions while lower values indicate less extreme conditions.,,C,TWmax = Tx * atan[(0.151977 * (RH13% + 8.313659)^(1/2))] + atan(Tx + RH13%) - atan(RH13% - 1.676331) + 0.00391838 * (RH13%)^(3/2) * atan(0.023101 * RH13%) - 4.686035,195,17,,
UHI index - Urban Heat Island Index,Normalized value of Difference between Measured tempearature and the minimum value in the spatial extense.,,--,(LSTi - LSTmin)/(LSTmax - LSTmin),196,16,,
UHII - Urban Heat Island Intensity,Difference of temperature between area affected by UHI and the surrounding rural area,,C,(Avg T LST urban - Avg LST surrounding area),197,16,,
UHImax - Maximum UHI intensity in 1 hour,max(Turban − Trural) from 1-h average data,,C,UHII_max = a * (⁴√(SR * DTR³ / U))      a = 2 - SVF - F_veg,198,16,,
Uii - Urban Impact Indicator,"indicator of the extent to which an urban meteorological station is influenced by winds traversing the built-up part of the city, and depends on the frequency distribution and the path length of winds of each wind directions across the city before reaching the meteorological station, summed over all wind directions",,--,"U_ii = Σ(K_i × F_i), where K_i = (L_1 / (L_1 + L_2)) × (L_1 / L_max)",199,16,,
Urban Heat Index,"Indicator that building height, Sensible heat, High termal inertia and antrophogenic heat flux",,--,"f( WH​ ,β,ΔQ S​ ,Q F​ )",200,16,GIS Overlay,
Urban Heat Island Percentage,Percentage of city area that is within the effects of Urban Heat Island,,%,(Sum(Area UHI)/Area City),201,16,,
URI - Urban Heat Island ratio Index,"Ratio of UHI area to urban area with the consideration of weightedvalues of each temperature level .The greater the URI , themore intense the UHI is",,--,"URI = (1/n) * Σ[i=1 to n] (ω_i * p_i) Where n is number of reclassified temperature value levels, usually
n is defined as 6 levels; i is the temperature value level range 1–6; w is a
weight using the temperature value of corresponding level i; p is the
percentage of level i occupying throughout the image scene",202,16,,
UTCI - Universal Thermal Climate Index,"Multi‐parameter index quantifying human thermal stress in outdoor environments, based on a dynamic thermophysiological model incorporating air temperature, humidity, wind and radiation",,--,"UTCI=f(T a​ ,RH,v,T r​ ,K ↓​ )",203,17,,
WBGT - Wet Bulb Globe Temperature,combined measure of temperature and humidity effects on thermal comfort,,C,0.7T wb​ +0.2T g​ +0.1T a​,204,17,"𝑇𝑤𝑏  : Natural wet-bulb temperature (°C), 𝑇𝑔  : Black globe temperature (°C),Ta : Air temperature (°C)",
WmN - number of Warmn Nights,Number of nights with temperature above 17°C,,d,Direct Measurement,205,16,,
Household Debt GDP,Percentage of GDP that corresponds to Household debt,,%,(Total household debt/GDP)*100,300,22,,
Buy to let stock,Share of property transactions in which the buyer is an investor (not an owner-occupier).,,%,Number of investor purchases/total sales per year *100,301,18,,
Geographical Mobility Rate,Percentage of population that change homes in a year,,%/year,Number of total movers in year / total population,302,21,,
Median Homeownership Tenure,Median ammount of years that a family owns a same place,,years,Median Move out - Move in date length for owner occupied household,303,21,,
New housing units completed,"number of residential units that have reached construction completion. These units are ready for occupancy, regardless of whether they are sold, rented, or still vacant.",,Homes/year,"NHU_y = \sum_{i=1}^{n} U_{i,y}\text{where:} \quad NHU_y = \text{Total number of new housing units completed in year } y, \quad U_{I,y} = \text{Units completed in project } I \text{ during year } y",304,20,,
Residential Investment,Percentage of GDP that corresponds to Investment in housing,,%,Total residential investment/ GDP *100,305,21,,
Lost Housing Stock,Number of homes destroyed by disasters or urban renovation,,Homes/Year,LHS y​ =∑Units demolished y​ +∑Units lost to disaster/re​,306,20,,
Total Housing Supply,Difference between new housing units and houses losts,,Homes/year,Sum(Completitions in year) - Sum (Lost Housing in year),307,18,,
Price to rent Ratio,"the ratio of home prices to annualized rent in a given location. is used as an indicator for whether housing markets are fairly valued, or in a bubble.",,--,RTP_i = \text{AnnualRent}_i \cdot \frac{1}{K} \sum_{j=1}^{K} \text{HomePrice}_j,308,22,,
Price to Income ratio - Affordability,nominal house price index divided by the nominal disposable income per head,,--,PIR = HP/HH_income,309,22,,
Unitary Listing Price,"Asking price of a property per unit of area, typically expressed as currency per square meter (e.g., €/m²).",,M.U./m2,\text{Unitary Listing Price} = \frac{\text{Listing Price}}{\text{Property Area (m^2)}},343,22,,
Residential Satisfaction,"Joint indicator of four sub indicators: overall satisfaction with the community environment, Word of mouth about community, overall saisfaction with housing unit, overall satisfaction with public facilities",,--,"RS i​ = 41​ (S i,comm​ +S i,wom​ +S i,unit​ +S i,pub​ )",344,19,,
Quality of Dweling,"Avg ( Water and electric supply + Match of house with occupant cultural WoL +  Aesthetic apperance of residences + Location of dwelling + Ammenities (toilet, kitchen, bathroom, washing areas)",,--,QD_i = \frac{1}{5} \left( WS_i + CM_i + AA_i + LD_i + AM_i \right)\]\text{where:}\quad\begin{cases}WS_i = \text{Water and electricity supply score} \\CM_i = \text{Cultural match with way of life} \\AA_i = \text{Aesthetic appearance score} \\LD_i ,345,19,,
Quality of Context,Avg (Education facilities + Open recreaction + commercial facilities + Healthcare faciliteis + Efficiency of infrastructural services + Social relationships + Accesibility and connectivity + Safety and security),,--,"QC i​ = 71​  k=1∑7​ C i,k​ , where 𝐶𝑖,𝑘C i,k​ =score on context domain k.",346,19,,
Quality of Life,Subjective: My life is close to my ideal here + The conditions of my life here are excellent + I am satisfied with my life here + So far I have gotten the important things I want in life + If I could relive my life I would prefere to stay here,,--,QL i​ = 51​ (L1 i​ +L2 i​ +L3 i​ +L4 i​ +L5 i​ ) where each 𝐿𝑥𝑖Lx i​  is a standard survey response.,347,19,,
Negotiation marging,"Average reduction from listing price to sale price, as a share of the listing price.",,%,((Listing price - Sale price)/Listing price *100,348,22,,
Purchasing power capacity,Number of average-priced homes affordable with one household’s annual disposable income.,,M.U.,PPC = \frac{ER}{MR} \cdot ITP \cdot [ 1 - \frac{1}{(1 + MR)^D},349,22,,
Urbanization rate,Percentage of the city area that is in the urban classification,,%,UR = \frac{Urban}{Urban+Rural || Total Area},350,21,,
Land Use Entropy,Quantifies the diversity of land-use types within a defined area. It is calculated as the ratio of the entropy (a measure of randomness or uncertainty) of the land-use distribution to the maximum possible entropy for the given number of land-use categorie,,--,\frac{\sum_{i=1}^{k} p^i \ln(p^i)}{\ln(k)} Where:𝑝𝑖p i  is the percentage of each land-use type in the buffer area𝑘k is the total number of land-use types.,351,19,,
House Price Index,measures the changes in the transaction prices of dwellings purchased by households,,--,\text{HPI}_t = \frac{\text{Average Price}_t}{\text{Average Price}_{\text{base}}} \times 100,352,22,,
New Mortages/credits per year,Count of newly approved home-purchase loans or credits in a calendar year.,,Mortgages/year,Count of mortgage or housing-credit agreements registered in year.,353,21,,
Monthly Sale Transactions,Number of housing units sold each month.,,Sales/month,Count of completed residential sale transactions in each month.,354,21,,
Time on sale market,Average number of months a property is listed for sale,,months,∑(SaleDate−ListDate)​ / Number sales,355,21,,
Spatial Accesibility  to Facilities - Straightness,"Distance to facilites like markets, greenspace, work, gas station, transport node, hospitals, etc",,m,"\text{Straightness}_i = \sum_{j \in G - \{i\};\ d[i,j] \leq r} \frac{\delta[i,j]}{d[i,j]}",356,19,,
Building Density,Average number of housing units per sqkm in urbanized areas.,,Buildings/km2,Total units in area /Total area km2,357,18,,
Household Ownership,Percentage of housholds living in their own home,,%,Owner occupied households /  Total households *100,358,21,,
Houshold permanency,Percentage of housholds having permanent house,,%,Households in permanent housing / Total households *100,359,21,,
