Indicator,Definition,System Part,Units,Calculation,ID,Objective,Comment
Publicly owned housing supply,Number of housing units delivered or made available by government or non-profit/public agencies during the period.,,Homes/year,POHS y​ =∑Public-sector units complet,360,20,,
Comfortable housing,Share of comfortable housing in the total housing stock,,%,Comfortable units / Total units *100,361,19,,
Social Housing demand,Proportion of families registerd as needing housing from the total number of families,,%,Reisgtered social housing applicants/ Total Families * 100,362,21,,
Social Housing supplied,Proportion of families who received social housing,,%,Households housed in social units / Eligeble households *100,363,20,,
Seller's Taxes,"Effective tax paid by sellers (stamp duty, capital gains) as a share of sale price.",,%,Total seller taxes / Sale price *100,364,22,,
Commerical diversity,proportion of each of the thirteen service facility types,,--,"Ei = ∑ik=1 pi ln(pi )  ln(k) where Ei represents the commercial diversity of unit i, pi is the proportion of each of the thirteen service facility types in unit i, and k is the number of facility types (with k = 13).",365,19,,
Road density,Road length per area of analysis,,km/km2,Total road length / total area,366,19,,
Housing price inflation,Average house inflation over the years,,%,HPIt - HPt-1 / HPIt-1 *100,367,22,,
Tax decuction rate,Share of mortgage interest payments that is tax-deductible.,,%,Deductible interest / Total Interest paid *100,368,22,,
Employment in construction,Share of total construction workforce employed specifically on residential‐housing projects.,,%,Housing sector construction jobs / total construction jobs,369,20,,
Share of wealth,Proportion of family wealth that is stored in real state,,%,Value of real estate assets / Total household assets *100,370,22,,
Housing Affordability stress,"Eflects the purchasing power of a representative household,  which is largely determined by the mortgage component, as households finance their house purchases with a large fraction of debt",,--,\frac{B_t}{P_t} = \gamma \frac{Y_t}{P_t} [ \frac{1 - (1 + R_t)^{-T}}{R_t} ],371,22,,
Price-to-CPI ratio,Relative movement of house prices compared to general consumer inflation.,,--,HPI/CPI,372,22,,
Price-ConstructionCosts ratio,Relative movement of house prices compared to building-cost inflation.,,--,HPI/CCI,373,22,,
Housing Lease Index,Composite index tracking changes in average rents over time (base year = 100).,,--,Weighted average rent in period ÷ Weighted average rent in base period × 100,374,22,,
Reach - Centrality,"How many buildings are reachable within a given network radius 𝑟r from location 𝑖i, weighted by the size (floor area) 𝑊[𝑗]W[j] of each building.",,m2,"\[ \text{Reach}'[i] = \sum_{j \in G - \{i\};\ d[i,j] \leq r} W[j] \]",375,19,,
Gravity - Centrality,"Measures ""attraction"" by combining building size 𝑊[𝑗]W[j] and the distance decay effect — farther buildings count less",,--,"\[\text{Gravity}'[i] = \sum_{j \in G - \{i\};\ d[i,j] \leq r} \frac{W[j]}{e^{\beta \cdot d[i,j]}}\]",376,19,,
Betweenness - Centrality,How often location 𝑖i lies on the shortest paths between pairs of other locations 𝑗j and 𝑘k.,,m2,"\[\text{Betweenness}'[i] = \sum_{j \in G - \{i\};\ d[I,j] \leq r} \frac{\eta_{jk}[i]}{\eta_{jk}} \cdot W[j]\]",377,19,,
Closeness - Centrality,Inverse of the average weighted distance to all reachable destinations.,,m^-3,"\[\text{Closeness}'[i] = \frac{1}{\sum_{j \in G - \{i\};\ d[I,j] \leq r} \left( d[I,j] \cdot W[j] \right)}\]",378,19,,
Average annual net migration rate,Annual net migration (in-minus out-migrants) relative to average population.,,%,((In - Out) /((POPy - POPy-1)/2)*100,379,21,,
Total Sales of commercial housing,Total market value of all commercial‐sector housing transactions in a period.,,M.U.,∑Sale value i​  for all residential/commercial transactions,380,22,,
Total sales area of commercial housing,Cumulative gross floor area (m²) of residential units sold in the commercial (non-subsidized) housing market during the period.,,m2,Sum Area of units,381,20,,
Numer of real state offers per year,Total count of property sale listings (offers) advertised over a year.,,Homes/year,Count of distinct sale offers posted in the year,382,18,,
Number of rental offers,Total count of rental property listings (offers) advertised over a year.,,Homes/year,Count of distinct rental offers posted in the year,383,18,,
Proportion of rental housing supply,Share of newly completed units that are intended for rental (market or subsidized) rather than sale.,,%,Rental unites completed / total units completed,384,20,,
Price to Downpayment Ratio,Average house price divided by the typical down-payment amount.,,--,Average house price / Average downpayment,385,22,,
Downpayment to Income Ratio,Share of annual disposable income required for the down-payment on an average home.,,--,Average downpayment / Average annual disposable income *100,386,22,,
LTV- Loan to Value ratio,Share of the property value financed through a mortgage.,,%,Mortage principal / Property value *100,387,22,,
Remodeling Affordability,Number of median‐income years required to fully fund an average home-remodel project.,,--,Average remodeling cost / Median annual income,388,22,,
Debt-to-Income ratio,Share of household income used to service all debt obligations (mortgage plus other loans).,,--,Annual debt payments / Annual disposable income *100,389,22,,
Surrounding air pollution,"Average concentration of PM2.5 SO2, O3",,ug/m3,PM2.5 + SO2+ O3 / 3,390,19,,
Crime rate,Number of recorded crimes on public space per 100 inhab,,crimes/hab,Crimes/population *100,391,19,,
Walkability,"Composite of sidewalk coverage, intersection density, block size, and land-use mix, indicating pedestrian friendliness.",,--,"WI i​ =w 1​ SidewalkCov i​ +w 2​ IntDen i​ +w 3​ BlkSize i​ +w 4​ Mix i​ ,",392,19,,
